{
  "version": "1.0.0",
  "deckId": "sample-deck",
  "title": "DeckGo V1 项目框架",
  "templateId": "clarity-blue",
  "theme": {
    "id": "clarity-blue",
    "name": "Clarity Blue",
    "palette": {
      "primary": "#0F5FFF",
      "secondary": "#1A2A52",
      "accent": "#00C2A8",
      "background": "#F7F9FC",
      "text": "#172033"
    }
  },
  "slides": [
    {
      "id": "slide-1",
      "kind": "title",
      "title": "DeckGo V1 项目框架",
      "notes": "面向学习和实践的大模型 PPT 生成系统。",
      "blocks": [
        {
          "id": "block-1",
          "kind": "text",
          "frame": { "x": 0.8, "y": 0.9, "w": 11.0, "h": 1.4 },
          "content": {
            "text": "DeckSpec 是整个系统的唯一真相。",
            "level": "h1"
          }
        },
        {
          "id": "block-2",
          "kind": "text",
          "frame": { "x": 0.8, "y": 2.0, "w": 10.6, "h": 1.2 },
          "content": {
            "text": "Spring Boot 负责业务流程，Vue 负责工作台，Node 负责可编辑 PPTX 导出。",
            "level": "body"
          }
        }
      ]
    },
    {
      "id": "slide-2",
      "kind": "content",
      "title": "最小闭环",
      "blocks": [
        {
          "id": "block-3",
          "kind": "shape",
          "frame": { "x": 0.8, "y": 1.2, "w": 11.2, "h": 4.2 },
          "content": {
            "shape": "rounded_rect",
            "label": "需求 / AI -> DeckSpec -> 预览 -> 渲染任务 -> PPTX"
          }
        }
      ]
    }
  ]
}
